tweet_id	image_id	tweet_text	image_path	class_label
910233914517655554	910233914517655554_0	Local volunteers staff busy Hurricane Irma Information Line at 800-955-5504. https://t.co/7aXi10fU0l #KeysRecovery https://t.co/R2Vc1Tz6si	D:\Workspace\Cotrain_CrisisMMD\data\CrisisMMD_v2.0\data_image\hurricane_irma\19_9_2017\910233914517655554_0.jpg	rescue_volunteering_or_donation_effort
911928966868484097	911928966868484097_0	Venezuela Delivers 10.4 Tons of Aid to Earthquake-Ravaged Mexico People - teleSUR English https://t.co/SwVc6P3ENn https://t.co/pV5TcOOGPu	D:\Workspace\Cotrain_CrisisMMD\data\CrisisMMD_v2.0\data_image\mexico_earthquake\24_9_2017\911928966868484097_0.jpg	rescue_volunteering_or_donation_effort
923640485742366721	923640485742366721_0	For survivors of California's #wildfires, #tax assistance is available https://t.co/X8QgwUehbK https://t.co/zkSM6FBx5n	D:\Workspace\Cotrain_CrisisMMD\data\CrisisMMD_v2.0\data_image\california_wildfires\26_10_2017\923640485742366721_0.jpg	rescue_volunteering_or_donation_effort
914634838623342592	914634838623342592_2	#HappeningNow Loadup of #SCGuard Engineer pallets heading to #PuertoRico for #HurricaneMaria recovery https://t.co/rsrbiEhTl7	D:\Workspace\Cotrain_CrisisMMD\data\CrisisMMD_v2.0\data_image\hurricane_maria\1_10_2017\914634838623342592_2.jpg	rescue_volunteering_or_donation_effort
912944540226609152	912944540226609152_1	RT @AJEnglish: Devastated scenes after #HurricaneMaria https://t.co/loD2EMN8H5 https://t.co/j6gAErpwWg	D:\Workspace\Cotrain_CrisisMMD\data\CrisisMMD_v2.0\data_image\hurricane_maria\27_9_2017\912944540226609152_1.jpg	vehicle_damage
904291309502038018	904291309502038018_0	Half a million cars destroyed by Harvey? https://t.co/aoEpoFU4Sx https://t.co/pVPzTLpl0K	D:\Workspace\Cotrain_CrisisMMD\data\CrisisMMD_v2.0\data_image\hurricane_harvey\3_9_2017\904291309502038018_0.jpg	vehicle_damage
904588625647689729	904588625647689729_0	Tips to avoid flood damaged cars after Harvey https://t.co/T39qllwpqd https://t.co/LJ98Ti6x8R	D:\Workspace\Cotrain_CrisisMMD\data\CrisisMMD_v2.0\data_image\hurricane_harvey\4_9_2017\904588625647689729_0.jpg	vehicle_damage
909971209290440706	909971209290440706_2	@LeeGoldbergABC7 We had a similar scene in St Thomas during Irma, this boat washed ashore https://t.co/xGLBBtu2cD	D:\Workspace\Cotrain_CrisisMMD\data\CrisisMMD_v2.0\data_image\hurricane_irma\19_9_2017\909971209290440706_2.jpg	vehicle_damage
901697605851336704	901697605851336704_1	RT @EmilyLo011: Currently stuck on Monroe.... R.I.P my truck... #HurricaneHarvey https://t.co/9f2UmEN1cg	D:\Workspace\Cotrain_CrisisMMD\data\CrisisMMD_v2.0\data_image\hurricane_harvey\27_8_2017\901697605851336704_1.jpg	vehicle_damage
909971209290440706	909971209290440706_1	@LeeGoldbergABC7 We had a similar scene in St Thomas during Irma, this boat washed ashore https://t.co/xGLBBtu2cD	D:\Workspace\Cotrain_CrisisMMD\data\CrisisMMD_v2.0\data_image\hurricane_irma\19_9_2017\909971209290440706_1.jpg	vehicle_damage
909720121001889792	909720121001889792_0	Commentary: Tesla Boosted Range Prior to Irma, Raises Connected Car Questions - https://t.co/sNqjEoRKBY via… https://t.co/C8OgaQctTu	D:\Workspace\Cotrain_CrisisMMD\data\CrisisMMD_v2.0\data_image\hurricane_irma\18_9_2017\909720121001889792_0.jpg	vehicle_damage
904366441952034820	904366441952034820_0	Harvey may have damaged one million cars https://t.co/Z0gRWoY2Sf #sky #news https://t.co/oE4URuRVcu	D:\Workspace\Cotrain_CrisisMMD\data\CrisisMMD_v2.0\data_image\hurricane_harvey\3_9_2017\904366441952034820_0.jpg	vehicle_damage
910153831241125888	910153831241125888_1	Friday night's 14-12 over Christ's Church was followed by Irma clean-up as community service. #Snyderfootball… https://t.co/I84Gtd88oo	D:\Workspace\Cotrain_CrisisMMD\data\CrisisMMD_v2.0\data_image\hurricane_irma\19_9_2017\910153831241125888_1.jpg	vehicle_damage
909740728909205504	909740728909205504_0	Florida Dairies Dealing with Aftermath of Irma, Some Dump Milk - https://t.co/0oqRo45HnB https://t.co/L64853wgE6	D:\Workspace\Cotrain_CrisisMMD\data\CrisisMMD_v2.0\data_image\hurricane_irma\18_9_2017\909740728909205504_0.jpg	vehicle_damage
910696337234120704	910696337234120704_0	Anchorage woman with close ties to latest Mexico City earthquake - https://t.co/LPb9BHJdGu https://t.co/PVN1LDcYLO	D:\Workspace\Cotrain_CrisisMMD\data\CrisisMMD_v2.0\data_image\mexico_earthquake\21_9_2017\910696337234120704_0.jpg	vehicle_damage
906081532141600768	906081532141600768_0	Not Enough Rental Cars for Drivers Flooded by Harvey - https://t.co/P92G9uDDps via @insreporters #insurance https://t.co/2I06ypeJ7T	D:\Workspace\Cotrain_CrisisMMD\data\CrisisMMD_v2.0\data_image\hurricane_harvey\8_9_2017\906081532141600768_0.jpg	vehicle_damage
904211370966740992	904211370966740992_0	RT @Nairametrics: Reports suggest Hurricane Harvey cars could be on its way to Nigeria https://t.co/1Cgw9sxHMy https://t.co/1pfMo3MJbM	D:\Workspace\Cotrain_CrisisMMD\data\CrisisMMD_v2.0\data_image\hurricane_harvey\3_9_2017\904211370966740992_0.jpg	vehicle_damage
905137359317897217	905137359317897217_0	Las Vegas News Drivers whose cars were flooded by Harvey can't find rentals https://t.co/u3MAiPsvTJ https://t.co/K6GrNhu0Z2	D:\Workspace\Cotrain_CrisisMMD\data\CrisisMMD_v2.0\data_image\hurricane_harvey\5_9_2017\905137359317897217_0.jpg	vehicle_damage
909469971469733889	909469971469733889_0	RT @ed_bleakney: Irma Racks up damage pile of boat's missing through out Gulf and all caribbean islands https://t.co/QJuVsbBzBU	D:\Workspace\Cotrain_CrisisMMD\data\CrisisMMD_v2.0\data_image\hurricane_irma\17_9_2017\909469971469733889_0.jpg	vehicle_damage
909894624898101248	909894624898101248_0	Some NOAA imagery of Summerland Key (near Keywest) where those cars had been parked for Irma https://t.co/qsFN8S7MTD	D:\Workspace\Cotrain_CrisisMMD\data\CrisisMMD_v2.0\data_image\hurricane_irma\18_9_2017\909894624898101248_0.jpg	vehicle_damage
910701367550992386	910701367550992386_1	My car lost against Hurricane Maria when 60ft palm tree fell on top of it! https://t.co/bmhN0OrIfX	D:\Workspace\Cotrain_CrisisMMD\data\CrisisMMD_v2.0\data_image\hurricane_maria\21_9_2017\910701367550992386_1.jpg	vehicle_damage
901650630363762691	901650630363762691_0	RT @waff48: WILD VIDEO: Hawk hitches ride in Houston cab during Harvey #HurricaneHarvey &gt;&gt; https://t.co/fdSe3vwwz2 https://t.co/364BIEiHp3	D:\Workspace\Cotrain_CrisisMMD\data\CrisisMMD_v2.0\data_image\hurricane_harvey\27_8_2017\901650630363762691_0.jpg	vehicle_damage
920042438181269504	920042438181269504_0	California Fire Pictures â€“ Buildings â€“ Cars Destroyed â€“ TreesÂ OK https://t.co/WKmBwV6IHt https://t.co/YAZxTQ0EF0	D:\Workspace\Cotrain_CrisisMMD\data\CrisisMMD_v2.0\data_image\california_wildfires\16_10_2017\920042438181269504_0.jpg	vehicle_damage
905486837162147841	905486837162147841_0	Reuters Exclusive- An army of tow trucks tackles Houston's flood-damaged cars from #Harvey https://t.co/FJB3sHeQrs https://t.co/bIbbdP0HUn	D:\Workspace\Cotrain_CrisisMMD\data\CrisisMMD_v2.0\data_image\hurricane_harvey\6_9_2017\905486837162147841_0.jpg	vehicle_damage
905750258981986304	905750258981986304_0	Found ! A truck load of hurricane panels #irma https://t.co/fysYlnk9Gg	D:\Workspace\Cotrain_CrisisMMD\data\CrisisMMD_v2.0\data_image\hurricane_irma\7_9_2017\905750258981986304_0.jpg	vehicle_damage
909409487030771712	909409487030771712_0	Toppled trailer homes in Big Pine Key post Irma (zoom in). Armies of SoFla police departments are helping with reli… https://t.co/mobueOM5e2	D:\Workspace\Cotrain_CrisisMMD\data\CrisisMMD_v2.0\data_image\hurricane_irma\17_9_2017\909409487030771712_0.jpg	vehicle_damage
910224723967127554	910224723967127554_0	NC Attorney General: Beware Flood Cars Following Harvey, Irma - https://t.co/z2bHo5iv7f https://t.co/b3g3aSxoTG	D:\Workspace\Cotrain_CrisisMMD\data\CrisisMMD_v2.0\data_image\hurricane_harvey\19_9_2017\910224723967127554_0.jpg	vehicle_damage
910170234492981248	910170234492981248_0	Boats, houses rest on top of houses in Big Pine Key after #Irma. @JeniseFernandez shows the damage on @WPLGLocal10… https://t.co/w3CFYCCiJH	D:\Workspace\Cotrain_CrisisMMD\data\CrisisMMD_v2.0\data_image\hurricane_irma\19_9_2017\910170234492981248_0.jpg	vehicle_damage
910262990540242944	910262990540242944_0	Houston was built for cars. What happens when #Harvey destroys 250,000 vehicles? https://t.co/zixLAlHjdy https://t.co/8ybWt5TqAe	D:\Workspace\Cotrain_CrisisMMD\data\CrisisMMD_v2.0\data_image\hurricane_harvey\19_9_2017\910262990540242944_0.jpg	vehicle_damage
