tweet_id	image_id	tweet_text	image_path	class_label
930102201825091585	930102201825091585_0	70,000 people need shelter after this 7.3-magnitude earthquake hit the border of Iran and Iraq. #SendingPrayersὤFἿD https://t.co/BL3FXUGhnM	D:\Workspace\Cotrain_CrisisMMD\data\CrisisMMD_v2.0\data_image\iraq_iran_earthquake\13_11_2017\930102201825091585_0.jpg	affected_individuals
911621942536474624	911621942536474624_0	RT @NBCNews: Another Mexico earthquake sends people panicking into streets https://t.co/sHbpiWnK0O https://t.co/RadDf8uZ84	D:\Workspace\Cotrain_CrisisMMD\data\CrisisMMD_v2.0\data_image\mexico_earthquake\23_9_2017\911621942536474624_0.jpg	affected_individuals
917965776384077825	917965776384077825_0	Deadly California Wildfire Affecting Thousands, Including Delaware County Native https://t.co/HFDrPZIQWD #philly https://t.co/jJH8zwOICt	D:\Workspace\Cotrain_CrisisMMD\data\CrisisMMD_v2.0\data_image\california_wildfires\11_10_2017\917965776384077825_0.jpg	affected_individuals
906293811541925894	906293811541925894_0	RT @abc13houston: AT 6: HEB employee waded through chest-deep water to reach work during Harvey https://t.co/78QBDCmvDs	D:\Workspace\Cotrain_CrisisMMD\data\CrisisMMD_v2.0\data_image\hurricane_harvey\8_9_2017\906293811541925894_0.jpg	affected_individuals
920029485423980544	920029485423980544_0	California Fire Evacuees Spend Sleepless Nights atÂ Shelters https://t.co/g7IQueOWEX https://t.co/a8IkdI9tgx	D:\Workspace\Cotrain_CrisisMMD\data\CrisisMMD_v2.0\data_image\california_wildfires\16_10_2017\920029485423980544_0.jpg	affected_individuals
922560865144012803	922560865144012803_0	Visiting family in Puerto Rico amid devastation https://t.co/mEN9ooUt5E via @yahoophoto https://t.co/68kT8Alnnu	D:\Workspace\Cotrain_CrisisMMD\data\CrisisMMD_v2.0\data_image\hurricane_maria\23_10_2017\922560865144012803_0.jpg	affected_individuals
905188910720004096	905188910720004096_0	Austin ISD prepares for 'thousands' of students displaced by #HurricaneHarvey. https://t.co/YtfjQ7FtLY https://t.co/A6xa7TqamH	D:\Workspace\Cotrain_CrisisMMD\data\CrisisMMD_v2.0\data_image\hurricane_harvey\5_9_2017\905188910720004096_0.jpg	affected_individuals
906020553558917120	906020553558917120_0	Residents still without power 2 weeks after Harvey https://t.co/K3sJlj2zBZ https://t.co/283ESQdxGg	D:\Workspace\Cotrain_CrisisMMD\data\CrisisMMD_v2.0\data_image\hurricane_harvey\8_9_2017\906020553558917120_0.jpg	affected_individuals
930308604200026112	930308604200026112_1	A terrifying chill runs down the spine seeing these images from earthquake-hit Iraq. God give them strength. https://t.co/CDx08WI1cM	D:\Workspace\Cotrain_CrisisMMD\data\CrisisMMD_v2.0\data_image\iraq_iran_earthquake\14_11_2017\930308604200026112_1.jpg	affected_individuals
905230326359891968	905230326359891968_2	East Texas woman headed to hometown of Rockport, devastated by Harvey: https://t.co/xsVTRpF3LJ https://t.co/qI75WauhrE	D:\Workspace\Cotrain_CrisisMMD\data\CrisisMMD_v2.0\data_image\hurricane_harvey\6_9_2017\905230326359891968_2.jpg	affected_individuals
909816306182103042	909816306182103042_0	Miami family evacuating from Irma finds their home away from home in Kinston! @wnct9 https://t.co/XA4bUr9L23	D:\Workspace\Cotrain_CrisisMMD\data\CrisisMMD_v2.0\data_image\hurricane_irma\18_9_2017\909816306182103042_0.jpg	affected_individuals
907404614043041793	907404614043041793_0	Watch Family Airlifted From Hurricane Harvey Floodwaters | NBC Nightly News https://t.co/vAn7jmQT5u https://t.co/nuvDLJ1KYP	D:\Workspace\Cotrain_CrisisMMD\data\CrisisMMD_v2.0\data_image\hurricane_harvey\12_9_2017\907404614043041793_0.jpg	affected_individuals
904837965440053248	904837965440053248_0	#Harvey may be gone but if you’re struggling, reach out. @distressline offers 24/7 support https://t.co/9vwLb2kYco https://t.co/sYbtiX7qUc	D:\Workspace\Cotrain_CrisisMMD\data\CrisisMMD_v2.0\data_image\hurricane_harvey\4_9_2017\904837965440053248_0.jpg	affected_individuals
909922362589454336	909922362589454336_0	“I Don’t Have Anything To Start Over” – Harvey Victims Pray For Relief As 1000s Remain… https://t.co/FuFg25AhIy https://t.co/Rna7BZOKq9	D:\Workspace\Cotrain_CrisisMMD\data\CrisisMMD_v2.0\data_image\hurricane_harvey\18_9_2017\909922362589454336_0.jpg	affected_individuals
916070325019987969	916070325019987969_0	'Wipe out' Puerto Rico debt? Hedge funds, residents at risk of losses #news https://t.co/VmDxdBtLa3	D:\Workspace\Cotrain_CrisisMMD\data\CrisisMMD_v2.0\data_image\hurricane_maria\5_10_2017\916070325019987969_0.jpg	affected_individuals
910243544551628800	910243544551628800_3	EXCLUSIVE: #Jacksonville couple describes their harrowing escape from #USVirginIslands after #Irma. Their story on‚Ä¶ https://t.co/pX0AxLgpMC	D:\Workspace\Cotrain_CrisisMMD\data\CrisisMMD_v2.0\data_image\hurricane_irma\19_9_2017\910243544551628800_3.jpg	affected_individuals
912286834595688448	912286834595688448_1	RT @vinylhxmmo: Thankfully me and my family survived #HurricaneMaria but my island is completely destroyed https://t.co/vwch89PMqF	D:\Workspace\Cotrain_CrisisMMD\data\CrisisMMD_v2.0\data_image\hurricane_maria\25_9_2017\912286834595688448_1.jpg	affected_individuals
906476295864946689	906476295864946689_0	My Kids and I Tried to Escape Hurricane Harvey — It Was Impossible #fitnessworldabs https://t.co/AQuopElKmO https://t.co/FH6NgsplWm	D:\Workspace\Cotrain_CrisisMMD\data\CrisisMMD_v2.0\data_image\hurricane_harvey\9_9_2017\906476295864946689_0.jpg	affected_individuals
917976747139846144	917976747139846144_0	RT @SF_SevagS: .@StateFarm is #HereToHelp customers affected by #wildfires in Northern California. #SantaRosa https://t.co/QitQNnrAfb	D:\Workspace\Cotrain_CrisisMMD\data\CrisisMMD_v2.0\data_image\california_wildfires\11_10_2017\917976747139846144_0.jpg	affected_individuals
917945051736629248	917945051736629248_0	RT @MariaVinci7: Pray for victims of California #wildfires á½’5â¤á½¤Fâ¤á½’5 https://t.co/ov70Qg2pF9	D:\Workspace\Cotrain_CrisisMMD\data\CrisisMMD_v2.0\data_image\california_wildfires\11_10_2017\917945051736629248_0.jpg	affected_individuals
913104985436692485	913104985436692485_1	A bathroom door saved this med student's life during Hurricane Maria https://t.co/mygQHQEobR via @nbcnews https://t.co/XfTXxxnxHl	D:\Workspace\Cotrain_CrisisMMD\data\CrisisMMD_v2.0\data_image\hurricane_maria\27_9_2017\913104985436692485_1.jpg	affected_individuals
906195501338558465	906195501338558465_0	Keep praying for Texas! These families have a long road ahead of them. #PrayforTexas https://t.co/xc2tq4vf8O https://t.co/XuzmW1hk4Y	D:\Workspace\Cotrain_CrisisMMD\data\CrisisMMD_v2.0\data_image\hurricane_harvey\8_9_2017\906195501338558465_0.jpg	affected_individuals
909792403388854273	909792403388854273_0	Irma scarred us for life https://t.co/FKM0ehBH29	D:\Workspace\Cotrain_CrisisMMD\data\CrisisMMD_v2.0\data_image\hurricane_irma\18_9_2017\909792403388854273_0.jpg	affected_individuals
918316317152890881	918316317152890881_0	Topeka woman worried for loved ones in path of California wildfires https://t.co/qAx5NHResn https://t.co/NC0kBzdUHT	D:\Workspace\Cotrain_CrisisMMD\data\CrisisMMD_v2.0\data_image\california_wildfires\12_10_2017\918316317152890881_0.jpg	affected_individuals
930432485892280320	930432485892280320_0	#Earthquake in #Iran Outside in the town of Sarpol-e Zahab . Thousands homeless. ὏7 by @AttaKenare @afpphoto #AFP https://t.co/VFRPSS4gk7	D:\Workspace\Cotrain_CrisisMMD\data\CrisisMMD_v2.0\data_image\iraq_iran_earthquake\14_11_2017\930432485892280320_0.jpg	affected_individuals
910148449240092672	910148449240092672_0	Secretary Perdue Gets First-Hand Aerial View of Irma Damage in Florida https://t.co/YJNBLWXSxJ https://t.co/qAbej7GMHo	D:\Workspace\Cotrain_CrisisMMD\data\CrisisMMD_v2.0\data_image\hurricane_irma\19_9_2017\910148449240092672_0.jpg	infrastructure_and_utility_damage
909759902188556288	909759902188556288_0	BRIEF-KLX Inc businesses modestly impacted by hurricanes Harvey and Irma https://t.co/ioxZheILmb	D:\Workspace\Cotrain_CrisisMMD\data\CrisisMMD_v2.0\data_image\hurricane_irma\18_9_2017\909759902188556288_0.png	infrastructure_and_utility_damage
906730240621334533	906730240621334533_0	Heavy water: Harvey sinks Houston ... temporarily https://t.co/oS252LVXWU https://t.co/Oq7hemoStk	D:\Workspace\Cotrain_CrisisMMD\data\CrisisMMD_v2.0\data_image\hurricane_harvey\10_9_2017\906730240621334533_0.jpg	infrastructure_and_utility_damage
910234928037728256	910234928037728256_0	Back when Irma hit. Tree broke halfway up and blocked our driveway. Got it cleaned up now at least https://t.co/nuqTek3f8b	D:\Workspace\Cotrain_CrisisMMD\data\CrisisMMD_v2.0\data_image\hurricane_irma\19_9_2017\910234928037728256_0.jpg	infrastructure_and_utility_damage
910220918064140289	910220918064140289_0	The homeowner happy to have power back on, our Lineman invited back to FL in Oct for a BBQ competition. Who can say… https://t.co/nFGToDWQK0	D:\Workspace\Cotrain_CrisisMMD\data\CrisisMMD_v2.0\data_image\hurricane_irma\19_9_2017\910220918064140289_0.jpg	infrastructure_and_utility_damage
906360027199557633	906360027199557633_0	RT @KPRC2: Go inside 1 of 9 HISD schools severely damaged by Hurricane Harvey https://t.co/ZO7OU9EaZH #KPRC2 https://t.co/4exGyaCpB9	D:\Workspace\Cotrain_CrisisMMD\data\CrisisMMD_v2.0\data_image\hurricane_harvey\9_9_2017\906360027199557633_0.jpg	infrastructure_and_utility_damage
913129126881570816	913129126881570816_0	Hurricane Maria destroyed the manatee lab and veterinary clinic. The manatees are safe. Help by donating to rebuild! https://t.co/eYqIgbtMBI	D:\Workspace\Cotrain_CrisisMMD\data\CrisisMMD_v2.0\data_image\hurricane_maria\27_9_2017\913129126881570816_0.jpg	infrastructure_and_utility_damage
910050984679919616	910050984679919616_0	Anyone responding to Hurricane Harvey, Hose, Irma and now Maria - Email support@mappt.com.au to receive a FREE Mapp‚Ä¶ https://t.co/jwykybloh2	D:\Workspace\Cotrain_CrisisMMD\data\CrisisMMD_v2.0\data_image\hurricane_irma\19_9_2017\910050984679919616_0.jpg	infrastructure_and_utility_damage
913992284986855424	913992284986855424_0	#HurricaneMaria wrecked the park i had my first kiss on. https://t.co/U2kRmBOUQM	D:\Workspace\Cotrain_CrisisMMD\data\CrisisMMD_v2.0\data_image\hurricane_maria\30_9_2017\913992284986855424_0.jpg	infrastructure_and_utility_damage
904461053580283905	904461053580283905_0	@PaIndylady @thehill Do you see all these cities on this? All have been damaged by Harvey. https://t.co/4vPclvGkeb	D:\Workspace\Cotrain_CrisisMMD\data\CrisisMMD_v2.0\data_image\hurricane_harvey\3_9_2017\904461053580283905_0.jpg	infrastructure_and_utility_damage
910228258146353152	910228258146353152_0	Workers Safely Dismantle #Construction Crane Damaged by Hurricane Irma https://t.co/VdxBq7upMt #safety |‚Ä¶ https://t.co/tCnBJOJjsA	D:\Workspace\Cotrain_CrisisMMD\data\CrisisMMD_v2.0\data_image\hurricane_irma\19_9_2017\910228258146353152_0.jpg	infrastructure_and_utility_damage
920635671353667586	920635671353667586_0	Iconic $17m 'Glass House' mansion burnt to the ground in killer California wildfires https://t.co/imB7LVqtIt https://t.co/4XhMBkkxn4	D:\Workspace\Cotrain_CrisisMMD\data\CrisisMMD_v2.0\data_image\california_wildfires\18_10_2017\920635671353667586_0.jpg	infrastructure_and_utility_damage
927266764928442370	927266764928442370_0	(Scale of Hurricane Maria damage in Puerto Rico shown in road-trip video Video) - https://t.co/Vxpepj5Ir1 https://t.co/YNDdPFIvPj	D:\Workspace\Cotrain_CrisisMMD\data\CrisisMMD_v2.0\data_image\hurricane_maria\5_11_2017\927266764928442370_0.jpg	infrastructure_and_utility_damage
904429898944667648	904429898944667648_2	RT @ABC11_WTVD: National Weather Service: Sanford, Angier hit by microburst not tornado. https://t.co/sAjiCVK84L https://t.co/5ILWYjSC0O	D:\Workspace\Cotrain_CrisisMMD\data\CrisisMMD_v2.0\data_image\hurricane_harvey\3_9_2017\904429898944667648_2.jpg	infrastructure_and_utility_damage
911784420734115840	911784420734115840_0	RT @rickycint: My family's hometown of Barranquitas, PR after Hurricane Maria. #HuracánMaría https://t.co/bahke587m7	D:\Workspace\Cotrain_CrisisMMD\data\CrisisMMD_v2.0\data_image\hurricane_maria\24_9_2017\911784420734115840_0.jpg	infrastructure_and_utility_damage
913015427059605504	913015427059605504_0	Hurricane Maria floods a quarter of D.R. banana farms, https://t.co/snYKgdCzas https://t.co/UWBJuAVWKk	D:\Workspace\Cotrain_CrisisMMD\data\CrisisMMD_v2.0\data_image\hurricane_maria\27_9_2017\913015427059605504_0.jpg	infrastructure_and_utility_damage
911663593019498496	911663593019498496_3	RT @HighvTweet: Cane Bay Area sustained damage. #stcroix #stx #hurricanemaria https://t.co/hFJdjRIhd3	D:\Workspace\Cotrain_CrisisMMD\data\CrisisMMD_v2.0\data_image\hurricane_maria\23_9_2017\911663593019498496_3.jpg	infrastructure_and_utility_damage
922115089519468545	922115089519468545_0	RT @pipecork: Virtual Zuckerberg high-fiving in front of flooding in Puerto Rico https://t.co/xoktndyKhH	D:\Workspace\Cotrain_CrisisMMD\data\CrisisMMD_v2.0\data_image\hurricane_maria\22_10_2017\922115089519468545_0.jpg	infrastructure_and_utility_damage
910238806422560768	910238806422560768_0	It's going to be difficult to film palm trees blowing in the wind during #HurricaneMaria Most palms shredded from‚Ä¶ https://t.co/LJfZuw5Gm1	D:\Workspace\Cotrain_CrisisMMD\data\CrisisMMD_v2.0\data_image\hurricane_irma\19_9_2017\910238806422560768_0.jpg	infrastructure_and_utility_damage
906744961072291840	906744961072291840_3	Houston citizens have thrown out 8 million+ cubic yards of drywall, furniture, appliances and clothing after Harvey https://t.co/EIrtS8SoNc	D:\Workspace\Cotrain_CrisisMMD\data\CrisisMMD_v2.0\data_image\hurricane_harvey\10_9_2017\906744961072291840_3.jpg	infrastructure_and_utility_damage
922999381657231360	922999381657231360_0	A worker removes damaged electrical installations from a street in Yabucoa, Puerto Rico. (Reuters) https://t.co/KNQK5UKez9	D:\Workspace\Cotrain_CrisisMMD\data\CrisisMMD_v2.0\data_image\hurricane_maria\25_10_2017\922999381657231360_0.jpg	infrastructure_and_utility_damage
905733588095823873	905733588095823873_0	Hurricane Irma damage so far revealed in shocking before and after photos https://t.co/nyX2iZWx7d https://t.co/krQ62gxkIl	D:\Workspace\Cotrain_CrisisMMD\data\CrisisMMD_v2.0\data_image\hurricane_irma\7_9_2017\905733588095823873_0.jpg	infrastructure_and_utility_damage
921629571128143872	921629571128143872_0	US #NuclearNavy Vet: #PuertoRico should go with #NuclearEnergy https://t.co/REcOGvmlpS Hurricane damaged Solar Park: https://t.co/C1a34wb5py	D:\Workspace\Cotrain_CrisisMMD\data\CrisisMMD_v2.0\data_image\hurricane_maria\21_10_2017\921629571128143872_0.jpg	infrastructure_and_utility_damage
909384460285526016	909384460285526016_0	In Irma-devastated Virgin Islands, resolve blends with worry of being forgotten https://t.co/lC3738M6u3 https://t.co/dNxovLvO2W	D:\Workspace\Cotrain_CrisisMMD\data\CrisisMMD_v2.0\data_image\hurricane_irma\17_9_2017\909384460285526016_0.jpg	infrastructure_and_utility_damage
910255209041022977	910255209041022977_0	#PuertoRico As it braces for Cat5 #Maria, 70,000 people still don't have power due to #Irma https://t.co/s8rWrUf78T https://t.co/aZMjSgyN9F	D:\Workspace\Cotrain_CrisisMMD\data\CrisisMMD_v2.0\data_image\hurricane_irma\19_9_2017\910255209041022977_0.jpg	infrastructure_and_utility_damage
910639492301647874	910639492301647874_0	Mexico earthquake kills five at one of the country's top universities #sismo https://t.co/JiEWqwWGXu	D:\Workspace\Cotrain_CrisisMMD\data\CrisisMMD_v2.0\data_image\mexico_earthquake\20_9_2017\910639492301647874_0.jpg	injured_or_dead_people
913102526383144961	913102526383144961_1	RT @CGTNOfficial: Three people from #Taiwan died in #MexicoEarthquake, Chinese embassy in Mexico confirms https://t.co/2Ig19YnCbs	D:\Workspace\Cotrain_CrisisMMD\data\CrisisMMD_v2.0\data_image\mexico_earthquake\27_9_2017\913102526383144961_1.jpg	injured_or_dead_people
919577456587264000	919577456587264000_0	Forty dead, neighborhoods burned to ash in California fires https://t.co/CoKHoVuWjw #USNews #USRC https://t.co/84x4QFsbrm	D:\Workspace\Cotrain_CrisisMMD\data\CrisisMMD_v2.0\data_image\california_wildfires\15_10_2017\919577456587264000_0.jpg	injured_or_dead_people
930058600160088065	930058600160088065_0	Latest numbers emerging from earthquake that hit #Iran &amp; #Iraq - 211 dead &amp; 2504 injured in Iran https://t.co/VELDpduSWz	D:\Workspace\Cotrain_CrisisMMD\data\CrisisMMD_v2.0\data_image\iraq_iran_earthquake\13_11_2017\930058600160088065_0.jpg	injured_or_dead_people
911720094266310656	911720094266310656_0	Over 138 Dead After Earthquake Rocks Mexico City https://t.co/bVqi6MoJK6 #supernepal https://t.co/a6bOiZIXZ2	D:\Workspace\Cotrain_CrisisMMD\data\CrisisMMD_v2.0\data_image\mexico_earthquake\23_9_2017\911720094266310656_0.jpg	injured_or_dead_people
901650672805978112	901650672805978112_0	One dead as Hurricane Harvey wrecks havoc in Rockport https://t.co/NxavbSvqdt https://t.co/C1PL41RrJ9	D:\Workspace\Cotrain_CrisisMMD\data\CrisisMMD_v2.0\data_image\hurricane_harvey\27_8_2017\901650672805978112_0.jpg	injured_or_dead_people
929996311478272000	929996311478272000_0	Atleast 207 Dead, Thousands Injured As 7.3-Magnitude Earthquake Hits Northern Border Region… https://t.co/8RVoot4B4Y https://t.co/glpJfPj0n7	D:\Workspace\Cotrain_CrisisMMD\data\CrisisMMD_v2.0\data_image\iraq_iran_earthquake\13_11_2017\929996311478272000_0.jpg	injured_or_dead_people
930334010248593409	930334010248593409_0	Iran in Mourning After Earthquake that Killed 430 https://t.co/0zSZ87lmKR https://t.co/2SG4vfoXfP	D:\Workspace\Cotrain_CrisisMMD\data\CrisisMMD_v2.0\data_image\iraq_iran_earthquake\14_11_2017\930334010248593409_0.jpg	injured_or_dead_people
904291469409878016	904291469409878016_0	Two more people confirmed dead in Texas in wake of Storm Harvey https://t.co/ftP4g8Cj6z https://t.co/HeiB7Fzno2	D:\Workspace\Cotrain_CrisisMMD\data\CrisisMMD_v2.0\data_image\hurricane_harvey\3_9_2017\904291469409878016_0.jpg	injured_or_dead_people
905268948828119044	905268948828119044_0	Multiple injuries last night from a long track tornado in #Ohio https://t.co/1BaVfKgBC4 #OHwx https://t.co/I5hRuV5vle	D:\Workspace\Cotrain_CrisisMMD\data\CrisisMMD_v2.0\data_image\hurricane_harvey\6_9_2017\905268948828119044_0.jpg	injured_or_dead_people
910614165076750337	910614165076750337_3	RT @ndtv: 'My house is full of blood': Over 145 dead in powerful #mexicoearthquake https://t.co/fMGPARDHK9 https://t.co/xEgeaDhBWI	D:\Workspace\Cotrain_CrisisMMD\data\CrisisMMD_v2.0\data_image\mexico_earthquake\20_9_2017\910614165076750337_3.jpg	injured_or_dead_people
918353176914427904	918353176914427904_0	RT @thedailybeast: Nearly two dozen dead in Californiaâ€™s massive wildfires https://t.co/5VJpvWYXdq https://t.co/wi9sMkDOhW	D:\Workspace\Cotrain_CrisisMMD\data\CrisisMMD_v2.0\data_image\california_wildfires\12_10_2017\918353176914427904_0.jpg	injured_or_dead_people
930071199157293056	930071199157293056_0	Deadly Quake: 328 People Dead and 2,500 Wounded as Terrible Earthquake Rocks… https://t.co/sfFet8uWrs https://t.co/GxGy1gkylp	D:\Workspace\Cotrain_CrisisMMD\data\CrisisMMD_v2.0\data_image\iraq_iran_earthquake\13_11_2017\930071199157293056_0.jpg	injured_or_dead_people
901650894151979008	901650894151979008_0	RT @itvnews: Judge in Texas confirms the first death cause by #HurricaneHarvey https://t.co/LhNmyhAwju https://t.co/X1lsrHu0gH	D:\Workspace\Cotrain_CrisisMMD\data\CrisisMMD_v2.0\data_image\hurricane_harvey\27_8_2017\901650894151979008_0.jpg	injured_or_dead_people
920167628303491073	920167628303491073_0	California Fires Leave 32 Dead, a Vast Landscape Charred, and a Sky Full of Soot https://t.co/1sY1GZ0Gc3 https://t.co/34tgXfRxx6	D:\Workspace\Cotrain_CrisisMMD\data\CrisisMMD_v2.0\data_image\california_wildfires\17_10_2017\920167628303491073_0.jpg	injured_or_dead_people
917795236595863552	917795236595863552_0	11 dead, thousands homeless as wildfires torch California wine country https://t.co/n4OrOaOgEV #Heatwave #Wildfires https://t.co/H1EmUrnzjF	D:\Workspace\Cotrain_CrisisMMD\data\CrisisMMD_v2.0\data_image\california_wildfires\10_10_2017\917795236595863552_0.jpg	injured_or_dead_people
930022107278381057	930022107278381057_0	Pics from Iran 204 person killed &amp; 1600 injured by #earthquake yesterday #زلزال_إيران https://t.co/gOAvZmB8fw	D:\Workspace\Cotrain_CrisisMMD\data\CrisisMMD_v2.0\data_image\iraq_iran_earthquake\13_11_2017\930022107278381057_0.jpg	injured_or_dead_people
918052612804505600	918052612804505600_0	California fire: 15 dead, 150 others still missing https://t.co/4yj30iguq2 #News #Nigeria https://t.co/Fw65rWrsVR	D:\Workspace\Cotrain_CrisisMMD\data\CrisisMMD_v2.0\data_image\california_wildfires\11_10_2017\918052612804505600_0.jpg	injured_or_dead_people
910586144462585857	910586144462585857_0	Earthquake in Mexico kills over 200, hope of finding survivorsÂ remains https://t.co/NhuFH9fQmW https://t.co/HdGZs094Rq	D:\Workspace\Cotrain_CrisisMMD\data\CrisisMMD_v2.0\data_image\mexico_earthquake\20_9_2017\910586144462585857_0.jpg	injured_or_dead_people
905545403386527745	905545403386527745_0	Relatively low #Harvey death toll is 'astounding' to experts https://t.co/nVrqV8sxcM https://t.co/WiHmMAIrOk	D:\Workspace\Cotrain_CrisisMMD\data\CrisisMMD_v2.0\data_image\hurricane_harvey\6_9_2017\905545403386527745_0.jpg	injured_or_dead_people
912111866595471360	912111866595471360_1	RT @Andalalucha: An unknown # of garment workers died in this factory in Mexico's 7.1 earthquake. https://t.co/xWZQ4PzNRy	D:\Workspace\Cotrain_CrisisMMD\data\CrisisMMD_v2.0\data_image\mexico_earthquake\25_9_2017\912111866595471360_1.jpg	injured_or_dead_people
901771298937982976	901771298937982976_0	UPDATE: 2 dead from effects of Harvey; thousands trapped in climbing floodwaters https://t.co/TcWozUdLMt https://t.co/teFbEqrOXQ	D:\Workspace\Cotrain_CrisisMMD\data\CrisisMMD_v2.0\data_image\hurricane_harvey\27_8_2017\901771298937982976_0.jpg	injured_or_dead_people
912436581847375872	912436581847375872_0	Fernanda Castillo Pays Tribute to Her Family Members Killed in Mexico's Earthquake https://t.co/tBwPJsGIuV https://t.co/NxBJ5pZ6mI	D:\Workspace\Cotrain_CrisisMMD\data\CrisisMMD_v2.0\data_image\mexico_earthquake\25_9_2017\912436581847375872_0.jpg	injured_or_dead_people
905239945958178816	905239945958178816_0	Selena's family mourning the death of Houston relatives killed in Harvey flooding https://t.co/4fHBy7q3D0 #KSATnews https://t.co/wfy4OPZUrI	D:\Workspace\Cotrain_CrisisMMD\data\CrisisMMD_v2.0\data_image\hurricane_harvey\6_9_2017\905239945958178816_0.jpg	injured_or_dead_people
901654445590806529	901654445590806529_0	RT @FOX8NOLA: The Latest: Judge says 1 Harvey death confirmed in Rockport https://t.co/9E8C2CedcX https://t.co/2OHX2jPTll	D:\Workspace\Cotrain_CrisisMMD\data\CrisisMMD_v2.0\data_image\hurricane_harvey\27_8_2017\901654445590806529_0.jpg	injured_or_dead_people
870294525419192324	870294525419192324_0	81 Bangladesh fishermen missing in the wake of Cyclone Mora https://t.co/I6wEaC49SJ https://t.co/yzZ9RQdLwd	D:\Workspace\Cotrain_CrisisMMD\data\CrisisMMD_v2.0\data_image\srilanka_floods\1_6_2017\870294525419192324_0.jpg	missing_or_found_people
913176220254138370	913176220254138370_0	The Search for a Springfield Woman's Family Member Ends After Earthquake Hits Mexico https://t.co/8Dy2Ss0rMi https://t.co/E5ADIUFVrg	D:\Workspace\Cotrain_CrisisMMD\data\CrisisMMD_v2.0\data_image\mexico_earthquake\27_9_2017\913176220254138370_0.jpg	missing_or_found_people
870161539948400641	870161539948400641_0	Bangladesh navy searches for 81 fishermen still missing after Mora cyclone https://t.co/8H7oGKWiTn https://t.co/QKpW02toiz	D:\Workspace\Cotrain_CrisisMMD\data\CrisisMMD_v2.0\data_image\srilanka_floods\1_6_2017\870161539948400641_0.jpg	missing_or_found_people
911889087782629376	911889087782629376_0	#Israeli delegation continues search efforts in #Mexico City after deadly earthquake. https://t.co/nj0b86HNw4 https://t.co/bGzSY3SIyu	D:\Workspace\Cotrain_CrisisMMD\data\CrisisMMD_v2.0\data_image\mexico_earthquake\24_9_2017\911889087782629376_0.jpg	missing_or_found_people
919575390028468225	919575390028468225_0	Family Reunited As Dog Survives California Wildfire:https://t.co/2ZyKdjCIwD https://t.co/hjVrh8Y9tR	D:\Workspace\Cotrain_CrisisMMD\data\CrisisMMD_v2.0\data_image\california_wildfires\15_10_2017\919575390028468225_0.jpg	missing_or_found_people
913241636590645248	913241636590645248_0	Hurricane Maria survivor: 'I feared for our lives' https://t.co/mvnmvdfTZQ https://t.co/5n6VVHf45Z	D:\Workspace\Cotrain_CrisisMMD\data\CrisisMMD_v2.0\data_image\hurricane_maria\28_9_2017\913241636590645248_0.jpg	missing_or_found_people
919715666264965121	919715666264965121_0	Family Reunites With Missing Dog Who Fled When Their Home Caught Fire Duringâ€¦ https://t.co/HqxUV1RAdi https://t.co/WYhWsfrZ77	D:\Workspace\Cotrain_CrisisMMD\data\CrisisMMD_v2.0\data_image\california_wildfires\16_10_2017\919715666264965121_0.jpg	missing_or_found_people
911721159791538176	911721159791538176_0	Family members of someone missing say the Lord's Prayer #MexicoEarthquake https://t.co/Y16X1qUpaq	D:\Workspace\Cotrain_CrisisMMD\data\CrisisMMD_v2.0\data_image\mexico_earthquake\23_9_2017\911721159791538176_0.jpg	missing_or_found_people
910232317901361153	910232317901361153_0	Just what I needed after bad Irma! We have 7 new babies on our First Coast. White Oak in Yulee- congrats to your br‚Ä¶ https://t.co/YYQ45g3xp9	D:\Workspace\Cotrain_CrisisMMD\data\CrisisMMD_v2.0\data_image\hurricane_irma\19_9_2017\910232317901361153_0.jpg	missing_or_found_people
910133672266944513	910133672266944513_0	While SFWMD's EOC remains activated to focus on #Irma recovery efforts, water managers are also closely monitoring… https://t.co/wMji4ZRcSk	D:\Workspace\Cotrain_CrisisMMD\data\CrisisMMD_v2.0\data_image\hurricane_irma\19_9_2017\910133672266944513_0.jpg	missing_or_found_people
